System Call - /sbin/parted /dev/sda8 print
Model: Unknown (unknown)
Disk /dev/sda8: 210MB
Sector size (logical/physical): 512B/4096B
Partition Table: loop
Disk Flags: 

Number  Start  End    Size   File system  Flags
 1      0.00B  210MB  210MB  ntfs


System Call - /sbin/hdparm -I /dev/sda8

/dev/sda8:

ATA device, with non-removable media
	Model Number:       ST1000LM024 HN-M101MBB                  
	Serial Number:      S2Y9J9AD711903      
	Firmware Revision:  2AR20002
	Transport:          Serial, ATA8-AST, SATA 1.0a, SATA II Extensions, SATA Rev 2.5, SATA Rev 2.6
Standards:
	Used: unknown (minor revision code 0x0028) 
	Supported: 9 8 7 6 5 
	Likely used: 9
Configuration:
	Logical		max	current
	cylinders	16383	16383
	heads		16	16
	sectors/track	63	63
	--
	CHS current addressable sectors:   16514064
	LBA    user addressable sectors:  268435455
	LBA48  user addressable sectors: 1953525168
	Logical  Sector size:                   512 bytes
	Physical Sector size:                  4096 bytes
	Logical Sector-0 offset:                  0 bytes
	device size with M = 1024*1024:      953869 MBytes
	device size with M = 1000*1000:     1000204 MBytes (1000 GB)
	cache/buffer size  = 16384 KBytes
	Form Factor: 2.5 inch
	Nominal Media Rotation Rate: 5400
Capabilities:
	LBA, IORDY(can be disabled)
	Queue depth: 32
	Standby timer values: spec'd by Standard, no device specific minimum
	R/W multiple sector transfer: Max = 16	Current = ?
	Advanced power management level: 128
	DMA: mdma0 mdma1 mdma2 udma0 udma1 udma2 udma3 udma4 udma5 *udma6 
	     Cycle time: min=120ns recommended=120ns
	PIO: pio0 pio1 pio2 pio3 pio4 
	     Cycle time: no flow control=120ns  IORDY flow control=120ns
Commands/features:
	Enabled	Supported:
	   *	SMART feature set
	    	Security Mode feature set
	   *	Power Management feature set
	   *	Write cache
	   *	Look-ahead
	   *	WRITE_BUFFER command
	   *	READ_BUFFER command
	   *	NOP cmd
	   *	DOWNLOAD_MICROCODE
	   *	Advanced Power Management feature set
	   *	48-bit Address feature set
	   *	Device Configuration Overlay feature set
	   *	Mandatory FLUSH_CACHE
	   *	FLUSH_CACHE_EXT
	   *	SMART error logging
	   *	SMART self-test
	   *	General Purpose Logging feature set
	   *	64-bit World wide name
	   *	IDLE_IMMEDIATE with UNLOAD
	   *	WRITE_UNCORRECTABLE_EXT command
	   *	{READ,WRITE}_DMA_EXT_GPL commands
	   *	Segmented DOWNLOAD_MICROCODE
	   *	Gen1 signaling speed (1.5Gb/s)
	   *	Gen2 signaling speed (3.0Gb/s)
	   *	Native Command Queueing (NCQ)
	   *	Phy event counters
	   *	Idle-Unload when NCQ is active
	   *	DMA Setup Auto-Activate optimization
	    	Device-initiated interface power management
	   *	Software settings preservation
	   *	SMART Command Transport (SCT) feature set
	   *	SCT Write Same (AC2)
	   *	SCT Error Recovery Control (AC3)
	   *	SCT Features Control (AC4)
	   *	SCT Data Tables (AC5)
Security: 
	Master password revision code = 65534
		supported
	not	enabled
	not	locked
	not	frozen
	not	expired: security count
		supported: enhanced erase
	206min for SECURITY ERASE UNIT. 206min for ENHANCED SECURITY ERASE UNIT. 
Logical Unit WWN Device Identifier: 50004cf20aa64fba
	NAA		: 5
	IEEE OUI	: 0004cf
	Unique ID	: 20aa64fba
Checksum: correct

System Call - /usr/bin/sdparm --inquiry /dev/sda8
    /dev/sda8: ATA       ST1000LM024 HN-M  0002
Device identification VPD page:
  Addressed logical unit:
    designator type: vendor specific [0x0],  code set: ASCII
      vendor specific: S2Y9J9AD711903      
    designator type: T10 vendor identification,  code set: ASCII
      vendor id: ATA     
      vendor specific: ST1000LM024 HN-M101MBB                  S2Y9J9AD711903      
    designator type: NAA,  code set: Binary
      0x50004cf20aa64fba

System Time Zone Is:IST

Start Time: July 27 2015 15:11:43 UTC
Acquisition command: /usr/bin/dcfldd hash=md5,sha256,sha512 hashlog=./S2Y9J9AD711903_20150727151143_hash.txt conv=noerror,sync if=/dev/sda8 of=./S2Y9J9AD711903_20150727151143.dd
Stop Time: July 27 2015 15:11:48 UTC
